{
  "schemaVersion": 1,
  "tenant": "example-team",
  "project": "example-pay",
  "provider": "provider-a",
  "product": "repay",
  "contractVersion": "1",
  "environment": "test",
  "task": "task-example",
  "repo": "repo-example",
  "branch": "feature/example",
  "commit": "aaaaaaaaaaaaaaaaaaaaaaaaaaaaaaaaaaaaaaaa",
  "agent": "example-agent",
  "now": "2026-09-12T00:00:00.000Z",
  "mode": "local",
  "complexity": "L3"
}
